{
  "sampleBatchId": "sample_1778147366051_781f1774",
  "caseIds": [
    "bc_1776997463483_fd433c"
  ],
  "requestedGoodcaseCount": 10,
  "requestedBadcaseCount": 10,
  "strategy": "stratified_random_v1_temp_eval",
  "createdAt": "2026-05-07T09:49:26.052Z",
  "actualGoodcaseCount": 0,
  "actualBadcaseCount": 1,
  "warnings": [
    "goodcase 请求 10 条，实际仅可取 0 条（池子 0 条，可能因哈希去重后不足）。",
    "badcase 请求 10 条，实际仅可取 1 条（池子 1 条，可能因哈希去重后不足）。"
  ]
}
